{
  "schema": 2,
  "topic": "ExampleStore migration constraints",
  "audience": "Platform engineers",
  "purpose": "Understand documented migration boundaries before selecting a path",
  "scope": "Supplied synthetic guide only; no real product claims",
  "source_mode": "selected",
  "sources": [
    {
      "id": "src-guide",
      "file": "source.md",
      "origin": "source.md",
      "title": "ExampleStore migration guide",
      "publisher": "Synthetic test fixture",
      "permission": "selected",
      "context": "full"
    }
  ],
  "facts": [
    {
      "id": "file-boundary",
      "statement": "Community Edition 4 and later snapshot files cannot be read by Loader.",
      "author": "fixture-author",
      "citations": [
        {
          "source": "src-guide",
          "quote": "Community Edition 4 and later produce snapshot files that Loader cannot read."
        }
      ]
    },
    {
      "id": "transfer-method",
      "statement": "The guide says Community Edition 4 datasets may be transferred using a custom adapter.",
      "author": "fixture-author",
      "citations": [
        {
          "source": "src-guide",
          "quote": "Community Edition 4 and later produce snapshot files that Loader cannot read.\nEnterprise Edition datasets may be transferred using a custom adapter; that process is outside this guide."
        }
      ]
    },
    {
      "id": "client-boundary",
      "statement": "Wire-protocol connection support does not guarantee identical transaction semantics.",
      "author": "fixture-author",
      "citations": [
        {
          "source": "src-guide",
          "quote": "Existing wire-protocol clients can connect to Loader 2. This does not guarantee identical transaction semantics."
        }
      ]
    }
  ],
  "findings": [
    {
      "id": "migration-path",
      "title": "A path for newer editions",
      "summary": {
        "text": "Community Edition 4 requires an adapter instead of snapshot loading.",
        "kind": "summary",
        "refs": [
          "file-boundary",
          "transfer-method"
        ]
      },
      "support": [
        "file-boundary",
        "transfer-method"
      ],
      "counter": [],
      "implications": [],
      "conditions": [],
      "gaps": []
    }
  ],
  "sections": [
    {
      "id": "decision",
      "title": "Migration approach",
      "blocks": [
        {
          "text": "The guide documents a custom adapter path for Community Edition 4.",
          "kind": "summary",
          "refs": [
            "transfer-method"
          ]
        },
        {
          "text": "Connection success alone does not demonstrate transaction equivalence.",
          "kind": "summary",
          "refs": [
            "client-boundary"
          ]
        }
      ]
    }
  ]
}
